{
  "schemaVersion": 1,
  "asOf": "2026-08-11",
  "status": "offline_audience_language_and_comprehension_preflight_ready_human_review_required",
  "purpose": "Make Mythical's marketing, social, support, and family-facing writing understandable without specialist knowledge. This control checks current internal examples, names the intended reader, asks for the plain meaning first, keeps sentences bounded, detects unexplained specialist language, refuses pressure and patronising language, and requires clear consequences for account, data, price, safety, privacy, AI, and permission messages. It supports children, teenagers, parents or guardians, general players, and professional readers without pretending that one score proves comprehension. Automated checks may flag a draft but may not approve or publish it. A human must still confirm accuracy, tone, age suitability, accessibility, cultural meaning, safeguarding, and whether a young reader and their parent would understand the important consequence on the first read.",
  "decisionRefs": ["D-002", "D-011", "D-014"],
  "riskRefs": ["R-001", "R-003", "R-009", "R-011"],
  "workflowRefs": ["A-003", "A-004", "A-005", "A-008", "A-013", "A-020", "A-025", "A-029", "A-033", "A-034", "A-039", "A-055"],
  "authority": {
    "contentApprovalAuthorized": false,
    "publicationAuthorized": false,
    "supportSendAuthorized": false,
    "replyAuthorized": false,
    "accountCreationAuthorized": false,
    "credentialUseAuthorized": false,
    "networkAccessAuthorized": false,
    "repositoryWriteAuthorized": false,
    "automatedDispatchAuthorized": false,
    "spendAuthorized": false,
    "externalActionAuthorized": false,
    "conversationIsAuthorization": false
  },
  "sourceBindings": [
    { "id": "ALS-001", "path": "docs/company/content/drafts/PROJECT_BEACON_INTRO.json", "selector": "copy", "audienceProfile": "general_player", "messageType": "marketing", "sensitiveTopic": null },
    { "id": "ALS-002", "path": "docs/company/content/campaigns/project-beacon-foundation.json", "selector": "canonical.copy", "audienceProfile": "general_player", "messageType": "marketing", "sensitiveTopic": null },
    { "id": "ALS-003", "path": "docs/company/content/campaigns/project-beacon-foundation.json", "selector": "variants.WV-001.copy", "audienceProfile": "general_player", "messageType": "social", "sensitiveTopic": null },
    { "id": "ALS-004", "path": "docs/company/content/campaigns/project-beacon-foundation.json", "selector": "variants.WV-002.copy", "audienceProfile": "professional", "messageType": "company", "sensitiveTopic": null },
    { "id": "ALS-005", "path": "docs/company/support/knowledge-base.json", "selector": "articles.KB-001.summary", "audienceProfile": "teen_13_17", "messageType": "support", "sensitiveTopic": "account" },
    { "id": "ALS-006", "path": "docs/company/support/knowledge-base.json", "selector": "articles.KB-002.summary", "audienceProfile": "teen_13_17", "messageType": "support", "sensitiveTopic": "data" },
    { "id": "ALS-007", "path": "docs/company/support/knowledge-base.json", "selector": "articles.KB-003.summary", "audienceProfile": "teen_13_17", "messageType": "support", "sensitiveTopic": "price" }
  ],
  "audienceProfiles": [
    { "id": "child_8_12", "maximumWordsPerSentence": 18, "plainMeaningFirst": true, "directNextStepWhenNeeded": true, "parentDetailSeparate": true },
    { "id": "teen_13_17", "maximumWordsPerSentence": 22, "plainMeaningFirst": true, "directNextStepWhenNeeded": true, "parentDetailSeparate": true },
    { "id": "parent_guardian", "maximumWordsPerSentence": 25, "plainMeaningFirst": true, "directNextStepWhenNeeded": true, "parentDetailSeparate": false },
    { "id": "general_player", "maximumWordsPerSentence": 25, "plainMeaningFirst": true, "directNextStepWhenNeeded": true, "parentDetailSeparate": true },
    { "id": "professional", "maximumWordsPerSentence": 30, "plainMeaningFirst": true, "directNextStepWhenNeeded": true, "parentDetailSeparate": false }
  ],
  "plainLanguagePolicy": {
    "plainMeaningBeforeTechnicalDetail": true,
    "youngReaderMustUnderstandFirstAnswer": true,
    "parentConsequenceMustBeVisible": true,
    "necessarySpecialistTermMustBeExplained": true,
    "readingScoreAloneMayApprove": false,
    "automatedCheckMayApprove": false,
    "humanReviewRequired": true,
    "accuracyMayNotBeSimplifiedAway": true,
    "childDirectedPressurePermitted": false,
    "patronisingLanguagePermitted": false,
    "singleAudienceAssumptionPermitted": false,
    "jargonTerms": ["control plane", "nonce", "payload", "cryptographic", "orchestration", "deterministic", "provenance", "runtime", "RPO", "RTO", "KMS", "SDK", "telemetry"],
    "pressurePatterns": ["act now", "hurry", "limited time", "don't miss out", "your companion needs you", "don't let them down", "keep your streak"],
    "patronisingPatterns": ["little ones", "kiddies", "this is easy", "even a child can", "grown-ups know best"],
    "blockedAbsolutePatterns": ["completely safe", "100% safe", "guaranteed secure", "fully autonomous", "sentient", "truly alive", "free forever"],
    "sensitiveTopics": ["account", "data", "price", "safety", "privacy", "AI", "permission"],
    "supportAnswerStarters": ["you can", "you cannot", "your progress is", "players can", "progress is", "the current", "ask a parent", "a parent or guardian"]
  },
  "referenceExamples": [
    { "id": "ALE-001", "audienceProfile": "child_8_12", "messageType": "support", "text": "You can start playing without an account. Ask a parent or guardian if you need help opening the game." },
    { "id": "ALE-002", "audienceProfile": "teen_13_17", "messageType": "support", "text": "Your progress is saved in this browser. If you clear the browser's data, your save may disappear." },
    { "id": "ALE-003", "audienceProfile": "parent_guardian", "messageType": "privacy", "text": "The game starts without an account. Optional online features have separate age and privacy checks." },
    { "id": "ALE-004", "audienceProfile": "general_player", "messageType": "marketing", "text": "Explore six living realms with an alien companion. You can play in your browser without downloading the game." },
    { "id": "ALE-005", "audienceProfile": "professional", "messageType": "company", "text": "Mythical uses AI tools to support repeatable studio work. People still approve important public, financial, safety, and product decisions." }
  ],
  "adversarialPlan": {
    "scenarioCount": 12,
    "expectedRefusalCount": 12,
    "scenarios": [
      { "id": "AL-001", "problem": "technical_language_first", "expectedReasonCode": "jargon_unexplained" },
      { "id": "AL-002", "problem": "sentence_too_long_for_child", "expectedReasonCode": "sentence_too_long" },
      { "id": "AL-003", "problem": "unexplained_acronym", "expectedReasonCode": "acronym_unexplained" },
      { "id": "AL-004", "problem": "support_answer_avoids_direct_answer", "expectedReasonCode": "direct_answer_missing" },
      { "id": "AL-005", "problem": "child_directed_urgency", "expectedReasonCode": "pressure_language" },
      { "id": "AL-006", "problem": "emotional_dependency_pressure", "expectedReasonCode": "pressure_language" },
      { "id": "AL-007", "problem": "patronising_young_reader", "expectedReasonCode": "patronising_language" },
      { "id": "AL-008", "problem": "unsafe_absolute_claim", "expectedReasonCode": "blocked_absolute" },
      { "id": "AL-009", "problem": "technical_detail_hides_parent_consequence", "expectedReasonCode": "parent_consequence_missing" },
      { "id": "AL-010", "problem": "audience_not_named", "expectedReasonCode": "audience_missing" },
      { "id": "AL-011", "problem": "accuracy_removed_during_simplification", "expectedReasonCode": "accuracy_boundary_missing" },
      { "id": "AL-012", "problem": "automated_check_claims_publication_approval", "expectedReasonCode": "authority_invalid" }
    ]
  },
  "auditExpectations": {
    "sourceCount": 7,
    "audienceProfileCount": 5,
    "referenceExampleCount": 5,
    "expectedCurrentSourcePassCount": 7,
    "expectedReferenceExamplePassCount": 5,
    "expectedSupportDirectAnswerPassCount": 3,
    "expectedSensitiveExplanationPassCount": 3,
    "expectedJargonHitCount": 0,
    "expectedUnexplainedAcronymCount": 0,
    "expectedLongSentenceCount": 0,
    "expectedPressureLanguageCount": 0,
    "expectedPatronisingLanguageCount": 0,
    "expectedBlockedAbsoluteCount": 0
  },
  "productionReviewPolicy": {
    "namedLanguageOwnerAssigned": false,
    "namedSafeguardingReviewerAssigned": false,
    "childComprehensionResearchCompleted": false,
    "teenComprehensionResearchCompleted": false,
    "parentComprehensionResearchCompleted": false,
    "accessibilityReviewCompleted": false,
    "localisationReviewCompleted": false,
    "liveContentConnected": false,
    "publishingConnectorConfigured": false,
    "supportConnectorConfigured": false,
    "automatedApprovalEnabled": false
  },
  "activationGates": [
    { "id": "AL-G01", "gate": "Name the language owner, backup, safeguarding reviewer, accessibility reviewer, and urgent escalation contact", "satisfied": false },
    { "id": "AL-G02", "gate": "Confirm the intended child, teen, parent, general-player, creator, press, partner, and professional audience boundaries", "satisfied": false },
    { "id": "AL-G03", "gate": "Test important game, account, data, price, AI, safety, privacy, purchase, permission, and help messages with representative readers", "satisfied": false },
    { "id": "AL-G04", "gate": "Record where young-player wording and parent detail must appear together, separately, or behind a clear link", "satisfied": false },
    { "id": "AL-G05", "gate": "Approve accuracy, claims, safeguarding, privacy, legal, accessibility, cultural, and localisation boundaries", "satisfied": false },